{
  "schema_version":"1.0",
  "phase":"MASTER_VALIDATION_P3_MULTIMODEL_TARGET",
  "status":"MULTIMODEL_TARGET_PARTIAL",
  "target":{"target_runtime":"EXAMPLE_ONLY","target_fingerprint_sha256":"0000000000000000000000000000000000000000000000000000000000000000"},
  "profile":{},
  "models":{},
  "judge_invocations":{},
  "checks":{"primary_secondary_models_real":"BLOCKED","model_router_real":"BLOCKED","judge_diversity_real":"BLOCKED","model_fallback_real":"BLOCKED"},
  "fallback":{"topology":null,"blocked_reason":"EXAMPLE_ONLY"},
  "artifact_index":{},
  "artifacts":[],
  "claims":{"real_model_identity_requires_successful_explicit_model_invocation":true,"semantic_model_independence_claimed":false},
  "observed_at":"1970-01-01T00:00:00.000Z",
  "receipt_sha256":"0000000000000000000000000000000000000000000000000000000000000000"
}
